{"$id":"urn:acme-firm:schema:rejection:1.0.0","$schema":"https://json-schema.org/draft/2020-12/schema","additionalProperties":false,"description":"Único rechazo S15, separado de las quince trazas de modulación.","properties":{"$schema":{"const":"../../../schemas/rejection.schema.json","type":"string"},"baseline_validation":{"const":"rejected","type":"string"},"classification_attempted":{"const":false,"type":"boolean"},"diagnostics":{"const":["HOST_BASELINE_OUT_OF_RANGE"],"type":"array"},"factor_validation_performed":{"const":false,"type":"boolean"},"modulation_attempted":{"const":false,"type":"boolean"},"modulation_trace":{"const":false,"type":"boolean"},"phase":{"const":"host_baseline","type":"string"},"rejection_id":{"const":"S15.rejection","type":"string"},"result_ref":{"const":"results/reference_run/S15.result.json","type":"string"},"scenario_id":{"const":"S15","type":"string"},"schema_version":{"const":"1.0.0","type":"string"},"trace_id_present":{"const":false,"type":"boolean"}},"required":["$schema","schema_version","rejection_id","scenario_id","result_ref","phase","baseline_validation","diagnostics","factor_validation_performed","modulation_attempted","classification_attempted","modulation_trace","trace_id_present"],"title":"IFATIGUE-INFRA6-M6 pre-modulation rejection contract","type":"object"}
