{"$schema":"../../../schemas/rejection.schema.json","baseline_validation":"rejected","classification_attempted":false,"diagnostics":["HOST_BASELINE_OUT_OF_RANGE"],"factor_validation_performed":false,"modulation_attempted":false,"modulation_trace":false,"phase":"host_baseline","rejection_id":"S15.rejection","result_ref":"results/reference_run/S15.result.json","scenario_id":"S15","schema_version":"1.0.0","trace_id_present":false}
